{
  "$schema": "https://json-schema.org/draft/2020-12/schema",
  "$id": "learning-path.schema.json",
  "title": "Visular AI Terms / Concepts - Learning Path",
  "type": "object",
  "required": ["schemaVersion", "id", "title", "description", "audience", "concepts"],
  "properties": {
    "schemaVersion": {"const": 1},
    "id": {"type": "string", "pattern": "^[a-z0-9]+(?:-[a-z0-9]+)*$"},
    "title": {"type": "string", "minLength": 1},
    "description": {"type": "string", "minLength": 20},
    "audience": {"enum": ["all", "senior-leader", "knowledge-worker"]},
    "concepts": {
      "type": "array",
      "minItems": 1,
      "uniqueItems": true,
      "items": {"type": "string", "pattern": "^[a-z0-9]+(?:-[a-z0-9]+)*$"}
    }
  },
  "additionalProperties": false
}
